{"artifacts":[{"artifact_id":"fluidlab-tables-3-4.txt","locator":"arXiv 2303.02346v1 PDF page 15","sha256":"d121d230e6a125cc2a36fb5bd5ed550945a3ada2af88b38a4ea15f72e487f67e","text":"                                        Action space              number of particles      number of grid cells\n         Task\n                             Trans. Velocity      Rot. Velocity      per fluid body            for gas field\n Latte Art (Pouring)          Along x and z                -               1000                       -\n Latte Art (Stirring)         Along x and z                -               1000                       -\n Ice Cream (Static)          Along x, y and z              -               2000                       -\nIce Cream (Dynamic)          Along x, y and z              -               2000                       -\n    Transporting              Along x and z         Around y                500                       -\n       Mixing                 Along x and z                -               1000                       -\n       Pouring                      -               Around z                500                       -\n  Gathering (Easy)            Along x and z                -                500                       -\n  Gathering (Hard)            Along x and z                -                500                       -\n   Air Circulation                  -               Around y                 -               128 × 9 × 128\n\n                                        Table 3: Task-specfic settings.\n\n                                                                   Lamé parameters\n                  Material                        Type                                    Density ρ\n                                                                      µ            λ\n                   Water                         Liquid              0.0         277.78      1.0\n                   Milk                          Liquid              0.0         277.78      1.0\n                Frothed Milk                 Viscous Liquid        208.33        277.78      1.0\n                  Coffee                         Liquid              0.0         277.78      1.0\n                 Ice Cream               Non-newtonian Liquid      416.67        277.78      0.5\n             Floating object                     Elastic           416.67        277.78      0.5\n                Sugar cube                   Viscous Liquid        208.33        277.78      1.0\n        Light Liquid in Pouring                  Liquid              0.0         277.78      0.8\n        Heavy Liquid in Pouring                  Liquid              0.0         277.78      1.5\n         Object in Transporting                   Rigid            416.67        277.78      5.0\n\n                        Table 4: Details of materials properties used in FluidLab.\n\n\n"},{"artifact_id":"fluidlab-runtime-settings.txt","locator":"arXiv 2303.02346v1 PDF page 14","sha256":"cfec9c4550b090f627244926512746238f8227795352bbdfdc59c317a2019b4d","text":"All our tasks use a simulation step of 2e-3 seconds, each containing 10 substeps of 1e-4 seconds for\nensuring simulation stability. All our proposed tasks contain around 100,000 particles and runs in\nreal time (60 FPS where each frame is a simulation step) on a desktop computer equipped with an\nNvidia RTX 3090 GPU and an Intel i7-8700K CPU, and the typical GPU usage is under 50%.\n"},{"artifact_id":"task","locator":"Section 4.1, PDF page 5","sha256":"6ed5e7a5f1a354ed465411ca296ddea629fe4ec51cda0a1334063f206045d8ba","text":"Fined Grained Pouring A glass filled with two types of non-Newtonian liquid with different densities, colored as blue and white respectively. The task is to pour the light blue liquid out of the glass\nwhile retaining as much white heavy liquid as possible.\n"},{"artifact_id":"observation-context","locator":"Appendix B.1, PDF page 14","sha256":"0ba2714369345fe6cfd418bd1ab52039ca4d365f271964df109a0acfe16edb95","text":"Each task has a task-specific action range and action space, with certain dimensions of the full\naction-space locked. We present our task-specific settings for action spaces, observed number of\nparticles per fluid body and observed number of grid cells in Table 3. Detailed properties of all\nmaterials used are listed in Table 4.\n\n"},{"artifact_id":"code-excerpt-0","locator":"https://github.com/zhouxian/FluidLab/blob/7295eb6ed7ee92b2be471fd30b432238577f28ce/fluidlab/configs/macros.py#L64","sha256":"94a4f433cabf06ce2d06196b681aa1cad65e3a57fa3946b8b0a28e8f06635b15","text":"############ material class #############\nMAT_CLASS = {\n    WATER          : MAT_LIQUID,\n    INVISCID_DEMO  : MAT_LIQUID,\n    INVISCID_DEMO2 : MAT_LIQUID,\n    INVISCID_DEMO3 : MAT_LIQUID,\n    VISCOUS_DEMO   : MAT_LIQUID,\n    MILK           : MAT_LIQUID,\n    COFFEE         : MAT_LIQUID,\n    ELASTIC        : MAT_ELASTIC,\n    ELASTIC_DEMO   : MAT_ELASTIC,\n    PLASTIC_DEMO   : MAT_PLASTO_ELASTIC_DEMO,\n    RIGID          : MAT_RIGID,\n    RIGID_HEAVY    : MAT_RIGID,\n    RIGID_LIGHT    : MAT_RIGID,\n    ICECREAM       : MAT_PLASTO_ELASTIC,\n    ICECREAM1       : MAT_PLASTO_ELASTIC,\n    MILK_VIS       : MAT_LIQUID,\n    COFFEE_VIS     : MAT_LIQUID,\n}\n"},{"artifact_id":"code-excerpt-1","locator":"https://github.com/zhouxian/FluidLab/blob/7295eb6ed7ee92b2be471fd30b432238577f28ce/fluidlab/configs/macros.py#L143","sha256":"17e8241b9db0a08c3a1051c6a832197ede982d8bc01d81121937ca1193891464","text":"MU = {\n    WATER          : 0.0,\n    INVISCID_DEMO  : 0.0,\n    INVISCID_DEMO2 : 0.0,\n    INVISCID_DEMO3 : 0.0,\n    VISCOUS_DEMO   : 800.0,\n    MILK           : 0.0,\n    COFFEE         : 0.0,\n    MILK_VIS       : 200.0,\n    COFFEE_VIS     : 200.0,\n    ELASTIC        : 416.67,\n    ELASTIC_DEMO   : 10.0,\n    PLASTIC_DEMO   : 160.0,\n    ICECREAM       : 416.67,\n    ICECREAM1       : 216.67,\n    RIGID          : 416.67,\n    RIGID_HEAVY    : 416.67,\n    RIGID_LIGHT    : 416.67,\n}\n\nLAMDA = {\n    WATER          : 277.78,\n    INVISCID_DEMO  : 277.78,\n    INVISCID_DEMO2 : 277.78,\n    INVISCID_DEMO3 : 277.78,\n    VISCOUS_DEMO   : 277.78,\n    MILK           : 277.78,\n    COFFEE         : 277.78,\n    MILK_VIS       : 277.78,\n    COFFEE_VIS     : 277.78,\n    ELASTIC        : 277.78,\n    ELASTIC_DEMO   : 100.0,\n    PLASTIC_DEMO   : 277.78,\n    ICECREAM       : 277.78,\n    ICECREAM1       : 277.78,\n    RIGID          : 277.78,\n    RIGID_HEAVY    : 277.78,\n    RIGID_LIGHT    : 277.78,\n}\n\nRHO = {\n    WATER          : 1.0,\n    INVISCID_DEMO  : 5.0,\n    INVISCID_DEMO2 : 1.0,\n    INVISCID_DEMO3 : 3.0,\n    VISCOUS_DEMO   : 5.0,\n    MILK           : 0.5,\n    COFFEE         : 1.0,\n    MILK_VIS       : 1.0,\n    COFFEE_VIS     : 1.0,\n    ELASTIC        : 1.0,\n    ELASTIC_DEMO   : 1.0,\n    PLASTIC_DEMO   : 1.0,\n    ICECREAM       : 0.5,\n    ICECREAM1       : 0.5,\n    RIGID          : 1.0,\n    RIGID_HEAVY    : 10.0,\n    RIGID_LIGHT    : 0.5,\n}\n"},{"artifact_id":"code-excerpt-2","locator":"https://github.com/zhouxian/FluidLab/blob/7295eb6ed7ee92b2be471fd30b432238577f28ce/fluidlab/envs/pouring_env.py#L18","sha256":"9e522ead77ee61ea38986eac4013310ed4a442053587ad8218c3455a7b597357","text":"        self.horizon               = 1000\n        self.horizon_action        = 1000\n        self.target_file           = None\n        self._n_obs_ptcls_per_body = 500\n        self.loss                  = loss\n        self.loss_type             = loss_type\n        self.action_range          = np.array([-0.02, 0.02])\n\n        # create a taichi env\n        self.taichi_env = TaichiEnv(\n            dim=3,\n            particle_density=1e6,\n            max_substeps_local=20,\n            gravity=(0.0, -20.0, 0.0),\n            horizon=self.horizon,\n        )\n        self.build_env()\n        self.gym_misc()\n\n    def setup_agent(self):\n        agent_cfg = CfgNode(new_allowed=True)\n        agent_cfg.merge_from_file(get_cfg_path('agent_pouring.yaml'))\n        self.taichi_env.setup_agent(agent_cfg)\n        self.agent = self.taichi_env.agent\n\n    def setup_statics(self):\n        pass\n\n    def setup_bodies(self):\n        self.taichi_env.add_body(\n            type='cylinder',\n            center=(0.6, 0.53, 0.5),\n            height=0.2,\n            radius=0.18,\n            material=MILK,\n        )\n        self.taichi_env.add_body(\n            type='cylinder',\n            center=(0.6, 0.73, 0.5),\n            height=0.2,\n            radius=0.18,\n            material=WATER,\n        )\n\n    def setup_boundary(self):\n"},{"artifact_id":"code-excerpt-3","locator":"https://github.com/zhouxian/FluidLab/blob/7295eb6ed7ee92b2be471fd30b432238577f28ce/fluidlab/fluidengine/simulators/mpm_simulator.py#L20","sha256":"21f226bc9514bb05feff428ec35ad73665e9bfeae370f85d72ede34e75972387","text":"\n        self.n_grid              = int(64 * quality)\n        self.dx                  = 1 / self.n_grid\n        self.inv_dx              = float(self.n_grid)\n        self.dt                  = 2e-4\n        self.p_vol               = (self.dx * 0.5) ** 2\n        self.res                 = (self.n_grid,) * self.dim\n        self.max_substeps_local  = max_substeps_local\n        self.max_substeps_global = max_substeps_global\n        self.horizon             = horizon\n        self.n_substeps          = int(2e-3 / self.dt)\n        self.max_steps_local     = int(self.max_substeps_local / self.n_substeps)\n\n        assert self.n_substeps * self.horizon < self.max_substeps_global\n        assert self.max_substeps_local % self.n_substeps == 0\n"},{"artifact_id":"code-excerpt-4","locator":"https://github.com/zhouxian/FluidLab/blob/7295eb6ed7ee92b2be471fd30b432238577f28ce/fluidlab/fluidengine/bodies/bodies.py#L62","sha256":"e4fc9ab441fd97f1158ddcbb991416d645bebc8c725db9a494f72ea430af169f","text":"        if color is not None:\n            body_color = color\n        else:\n            body_col